{
  "bwb-id": "BWBR0024096",
  "artikel": "9.5",
  "opgehaald-op": "2026-05-15",
  "versiedatum": "2026-01-01",
  "citeertitel": "Leidraad Invordering 2008",
  "bronreferentie": "jci1.3:c:BWBR0024096&artikel=9.5",
  "pad": "Artikel 1 Inleiding en toepassingsgebied > 9.5 Begrippen bij betalingstermijnen",
  "leden": [
    {
      "lid": "",
      "tekst": "Als de betalingstermijn van een aanslag is gesteld op één maand of is gesteld op zes weken, dan houdt dat in dat als de dagtekening van een aanslagbiljet valt op 31 oktober, de betalingstermijn van één maand vervalt op 30 november en de betalingstermijn van zes weken vervalt op 12 december.Als de dagtekening 28 februari is, dan vervalt de betalingstermijn van een maand op 31 maart en de betalingstermijn van zes weken op 11 april, tenzij het jaartal aangeeft dat het een schrikkeljaar is, in welk geval de termijn vervalt op 28 maart dan wel 10 april.Als de dagtekening van het aanslagbiljet valt op een andere dag dan de laatste dag van de kalendermaand, vervalt de termijn een maand later (bij een betalingstermijn van een maand) op de dag die hetzelfde nummer heeft als dat van de dagtekening. Als de dagtekening bijvoorbeeld 15 maart is, vervalt de termijn dus op 15 april. Is de betalingstermijn zes weken en is de dagtekening 15 maart, vervalt de termijn op 26 april."
    }
  ],
  "sectie": "9.5 Begrippen bij betalingstermijnen",
  "formaat": "plain"
}
