{
  "bwb-id": "BWBR0024096",
  "artikel": "9.1",
  "opgehaald-op": "2026-05-16",
  "versiedatum": "2026-01-01",
  "citeertitel": "Leidraad Invordering 2008",
  "bronreferentie": "jci1.3:c:BWBR0024096&artikel=9.1",
  "pad": "Artikel 1 Inleiding en toepassingsgebied > 9.1 Afwijking van de betalingstermijnen in geval van voorlopige aanslagen",
  "leden": [
    {
      "lid": "",
      "tekst": "In de gevallen waarin voor voorlopige aanslagen (bedoeld in [artikel 9, vijfde lid, van de wet](jci1.3:c:BWBR0004770&artikel=9)) die zijn gedagtekend in november of eerder, toepassing van de [wet](jci1.3:c:BWBR0004770) er toe zou leiden dat de enige of laatste betalingstermijn eindigt voor 31 december, dan wordt de vervaldag van deze termijn op 31 december gesteld. Bij afwijkende boekjaren wordt de laatste vervaldag steeds op de laatste dag van de maand gesteld."
    }
  ],
  "sectie": "9.1 Afwijking van de betalingstermijnen in geval van voorlopige aanslagen",
  "formaat": "plain"
}
